{
  "panel_name": "finops-review",
  "panel_version": "1.0.0",
  "confidence_score": 0.85,
  "risk_level": "negligible",
  "compliance_score": 1.0,
  "destruction_recommended": false,
  "requires_human_approval": false,
  "policy_flags": [],
  "requires_human_review": false,
  "timestamp": "2026-03-02T00:00:00Z",
  "findings": [
    {
      "persona": "finops/finops-strategist",
      "verdict": "approve",
      "confidence": 0.85,
      "rationale": "No cloud financial management impact. Change modifies Python project configuration in a governance framework repository. No cloud resources provisioned, no billing configurations altered, no unit economics impact.",
      "findings_count": {
        "critical": 0,
        "high": 0,
        "medium": 0,
        "low": 0,
        "info": 1
      }
    },
    {
      "persona": "finops/resource-optimizer",
      "verdict": "approve",
      "confidence": 0.85,
      "rationale": "No cloud resources introduced or modified. Addition of pytest-html dev dependency adds negligible CI overhead (<2s per test run) and <1MB disk per HTML report. No right-sizing or idle resource concerns.",
      "findings_count": {
        "critical": 0,
        "high": 0,
        "medium": 0,
        "low": 0,
        "info": 1
      }
    },
    {
      "persona": "finops/shutdown-decommission-analyst",
      "verdict": "approve",
      "confidence": 0.85,
      "rationale": "No resources being decommissioned, shut down, or destroyed. No infrastructure lifecycle changes. No destruction candidates identified.",
      "findings_count": {
        "critical": 0,
        "high": 0,
        "medium": 0,
        "low": 0,
        "info": 0
      }
    },
    {
      "persona": "finops/savings-plan-advisor",
      "verdict": "approve",
      "confidence": 0.85,
      "rationale": "No cloud compute, storage, or network resources affected. No savings plan coverage changes. No commitment-based discount implications. Change is entirely within development tooling configuration.",
      "findings_count": {
        "critical": 0,
        "high": 0,
        "medium": 0,
        "low": 0,
        "info": 0
      }
    },
    {
      "persona": "finops/cost-allocation-auditor",
      "verdict": "approve",
      "confidence": 0.85,
      "rationale": "No new resources requiring tagging or cost allocation. No impact to showback/chargeback models. No cost center mapping changes. No taggable resources in scope.",
      "findings_count": {
        "critical": 0,
        "high": 0,
        "medium": 0,
        "low": 0,
        "info": 0
      }
    }
  ],
  "aggregate_verdict": "approve",
  "execution_context": {
    "repository": "convergent-systems-co/dark-forge",
    "branch": "feat/retire-prompt-chaining",
    "commit_sha": "f3c7d18b6d6af376cce384598ac37e905d5a5b9d",
    "pr_number": 587,
    "policy_profile": "default",
    "triggered_by": "manual"
  }
}
