{
  "panel_name": "migration-review",
  "panel_version": "1.0.0",
  "schema_version": "1.0.0",
  "confidence_score": 0.85,
  "risk_level": "low",
  "compliance_score": 0.9,
  "policy_flags": [],
  "requires_human_review": true,
  "timestamp": "2026-02-25T00:00:00Z",
  "findings": [
    {
      "persona": "domain/backend-engineer",
      "verdict": "approve",
      "confidence": 0.85,
      "rationale": "Baseline emission \u2014 no database migrations or data transformations in governance configuration repo. Panel evaluates migration plans, rollback procedures, and data integrity when migration changes are present.",
      "findings_count": {
        "critical": 0,
        "high": 0,
        "medium": 0,
        "low": 0,
        "info": 0
      }
    },
    {
      "persona": "operations/sre",
      "verdict": "approve",
      "confidence": 0.85,
      "rationale": "No operational migration risk. Configuration changes are backward compatible and idempotent.",
      "findings_count": {
        "critical": 0,
        "high": 0,
        "medium": 0,
        "low": 0,
        "info": 0
      }
    }
  ],
  "aggregate_verdict": "approve",
  "execution_context": {
    "repository": "convergent-systems-co/dark-forge",
    "policy_profile": "default",
    "model_version": "claude-opus-4-6",
    "triggered_by": "manual"
  },
  "data_classification": {
    "level": "internal"
  }
}
