{
  "panel_name": "data-governance-review",
  "panel_version": "1.0.0",
  "schema_version": "1.0.0",
  "confidence_score": 0.85,
  "risk_level": "low",
  "compliance_score": 1.0,
  "policy_flags": [],
  "requires_human_review": false,
  "timestamp": "2026-02-23T23:50:00Z",
  "findings": [
    {
      "persona": "architecture/data-architect",
      "verdict": "approve",
      "confidence": 0.85,
      "rationale": "Governance panel definition follows canonical model standards from dach-canonical-models. Naming conventions, external reference discipline, and deployment governance rules are correctly encoded."
    },
    {
      "persona": "compliance/compliance-officer",
      "verdict": "approve",
      "confidence": 0.88,
      "rationale": "Data governance enforcement covers all enterprise standards. Missing-canonical workflow ensures cross-repo traceability. Audit trail requirements met via structured emissions."
    }
  ],
  "aggregate_verdict": "approve",
  "execution_context": {
    "repository": "SET-Apps/ai-submodule",
    "branch": "NETWORK_ID/feat/126/data-governance-enforcement",
    "policy_profile": "default",
    "model_version": "claude-opus-4-6",
    "triggered_by": "manual"
  }
}
