{
  "panel_name": "technical-debt-review",
  "panel_version": "1.0.0",
  "schema_version": "1.0.0",
  "confidence_score": 0.85,
  "risk_level": "low",
  "compliance_score": 0.9,
  "policy_flags": [],
  "requires_human_review": true,
  "timestamp": "2026-02-25T00:00:00Z",
  "findings": [
    {
      "persona": "quality/refactor-specialist",
      "verdict": "approve",
      "confidence": 0.85,
      "rationale": "Baseline emission \u2014 governance artifacts follow consistent patterns. Deprecated personas/panels tracked for removal. No code duplication in configuration files.",
      "findings_count": {
        "critical": 0,
        "high": 0,
        "medium": 0,
        "low": 0,
        "info": 0
      }
    },
    {
      "persona": "architecture/systems-architect",
      "verdict": "approve",
      "confidence": 0.85,
      "rationale": "Architectural debt is managed \u2014 Phase 5 sub-phases have clear achievability assessments. Backward compatibility maintained through additive changes and semantic versioning.",
      "findings_count": {
        "critical": 0,
        "high": 0,
        "medium": 0,
        "low": 0,
        "info": 0
      }
    }
  ],
  "aggregate_verdict": "approve",
  "execution_context": {
    "repository": "convergent-systems-co/dark-forge",
    "policy_profile": "default",
    "model_version": "claude-opus-4-6",
    "triggered_by": "manual"
  },
  "data_classification": {
    "level": "internal"
  }
}
