{
  "panel_name": "governance-compliance-review",
  "panel_version": "1.0.0",
  "schema_version": "1.0.0",
  "confidence_score": 0.95,
  "risk_level": "low",
  "compliance_score": 1.0,
  "policy_flags": [],
  "requires_human_review": false,
  "timestamp": "2026-02-25T00:00:00Z",
  "findings": [
    {
      "persona": "compliance/governance-auditor",
      "verdict": "approve",
      "confidence": 0.95,
      "rationale": "Baseline emission \u2014 governance pipeline fully adhered to. Plan created before implementation, all required panels executed, documentation updated, conventional commits used, branch naming follows convention.",
      "findings_count": {
        "critical": 0,
        "high": 0,
        "medium": 0,
        "low": 0,
        "info": 0
      }
    },
    {
      "persona": "compliance/process-analyst",
      "verdict": "approve",
      "confidence": 0.95,
      "rationale": "All governance steps completed in order. No process violations detected. Structured emissions properly formatted with valid JSON between markers.",
      "findings_count": {
        "critical": 0,
        "high": 0,
        "medium": 0,
        "low": 0,
        "info": 0
      }
    }
  ],
  "aggregate_verdict": "approve",
  "execution_context": {
    "repository": "convergent-systems-co/dark-forge",
    "policy_profile": "default",
    "model_version": "claude-opus-4-6",
    "triggered_by": "manual"
  },
  "data_classification": {
    "level": "internal"
  }
}
