{
  "panel_name": "threat-model-system",
  "panel_version": "1.0.0",
  "schema_version": "1.0.0",
  "confidence_score": 0.85,
  "risk_level": "low",
  "compliance_score": 0.9,
  "policy_flags": [],
  "requires_human_review": false,
  "timestamp": "2026-02-26T03:30:00Z",
  "findings": [
    {
      "persona": "architecture/systems-architect",
      "verdict": "approve",
      "confidence": 0.9,
      "rationale": "Architecture documented with trust zones and trust boundaries. Data flow diagrams complete. Component inventory verified. External dependencies cataloged.",
      "findings_count": {
        "critical": 0,
        "high": 0,
        "medium": 0,
        "low": 0,
        "info": 0
      }
    },
    {
      "persona": "compliance/mitre-analyst",
      "verdict": "approve",
      "confidence": 0.85,
      "rationale": "Trust boundary crossings cataloged. STRIDE analysis complete for all boundaries. Threat actor profiles with relevant TTPs documented. Attack trees constructed for primary objectives.",
      "findings_count": {
        "critical": 0,
        "high": 0,
        "medium": 0,
        "low": 0,
        "info": 0
      }
    },
    {
      "persona": "security/red-team-engineer",
      "verdict": "approve",
      "confidence": 0.85,
      "rationale": "Attack paths validated. No unmitigated critical paths identified. Existing controls adequate for current attack surface.",
      "findings_count": {
        "critical": 0,
        "high": 0,
        "medium": 0,
        "low": 0,
        "info": 0
      }
    },
    {
      "persona": "operations/infrastructure-engineer",
      "verdict": "approve",
      "confidence": 0.88,
      "rationale": "Infrastructure configuration assessed. IAM scope appropriate. Network segmentation adequate. Encryption settings maintained.",
      "findings_count": {
        "critical": 0,
        "high": 0,
        "medium": 0,
        "low": 0,
        "info": 0
      }
    },
    {
      "persona": "security/blue-team-engineer",
      "verdict": "approve",
      "confidence": 0.82,
      "rationale": "Detection coverage adequate. No critical alerting gaps. Incident response readiness assessed.",
      "findings_count": {
        "critical": 0,
        "high": 0,
        "medium": 0,
        "low": 0,
        "info": 0
      }
    },
    {
      "persona": "security/purple-team-engineer",
      "verdict": "approve",
      "confidence": 0.8,
      "rationale": "ATT&CK technique coverage mapped for relevant techniques. No new validation exercises required.",
      "findings_count": {
        "critical": 0,
        "high": 0,
        "medium": 0,
        "low": 0,
        "info": 0
      }
    },
    {
      "persona": "compliance/security-auditor",
      "verdict": "approve",
      "confidence": 0.88,
      "rationale": "Vulnerability classification complete. No critical or high severity findings. CVSS scoring applied where applicable.",
      "findings_count": {
        "critical": 0,
        "high": 0,
        "medium": 0,
        "low": 0,
        "info": 0
      }
    },
    {
      "persona": "compliance/compliance-officer",
      "verdict": "approve",
      "confidence": 0.85,
      "rationale": "Regulatory impact assessed. SOC 2 Type II, GDPR, and NIST 800-53 controls evaluated.",
      "findings_count": {
        "critical": 0,
        "high": 0,
        "medium": 0,
        "low": 0,
        "info": 0
      }
    }
  ],
  "aggregate_verdict": "approve",
  "execution_context": {
    "repository": "SET-Apps/ai-submodule",
    "policy_profile": "default",
    "model_version": "claude-opus-4-6",
    "triggered_by": "manual"
  }
}
