{
  "panel_name": "documentation-review",
  "panel_version": "1.0.0",
  "schema_version": "1.0.0",
  "confidence_score": 0.9,
  "risk_level": "low",
  "compliance_score": 1.0,
  "policy_flags": [],
  "requires_human_review": false,
  "timestamp": "2026-02-21T18:30:00Z",
  "findings": [
    {
      "persona": "leadership/mentor",
      "verdict": "approve",
      "confidence": 0.9,
      "rationale": "Base instructions trimmed to ~90 tokens (under 200 budget). Five domain-specific files each under 500 tokens. ANCHOR markers correctly placed. No cross-file dependencies."
    },
    {
      "persona": "engineering/ux-engineer",
      "verdict": "approve",
      "confidence": 0.9,
      "rationale": "Consistent structure across all decomposed files. Loaded-for headers aid JIT context. PHASE markers use descriptive names appropriate for standalone instruction files."
    }
  ],
  "aggregate_verdict": "approve",
  "execution_context": {
    "repository": "SET-Apps/ai-submodule",
    "branch": "NETWORK_ID/11-instruction-decomposition",
    "pr_number": 17,
    "policy_profile": "default",
    "model_version": "claude-opus-4-6",
    "triggered_by": "manual"
  }
}
