{
  "panel_name": "code-review",
  "panel_version": "1.0.0",
  "schema_version": "1.0.0",
  "confidence_score": 0.9,
  "risk_level": "low",
  "compliance_score": 1.0,
  "policy_flags": [],
  "requires_human_review": false,
  "timestamp": "2026-02-21T18:30:00Z",
  "findings": [
    {
      "persona": "quality/code-reviewer",
      "verdict": "approve",
      "confidence": 0.9,
      "rationale": "Workflow logic is sound. Changelog and update jobs separated correctly. fail-fast disabled for matrix. Job disabled with if:false until consuming repos configured."
    },
    {
      "persona": "compliance/security-auditor",
      "verdict": "approve",
      "confidence": 0.88,
      "rationale": "Secret passed via env var (not inline). Token validation fails fast if missing. peter-evans/create-pull-request pinned to SHA for supply chain security."
    }
  ],
  "aggregate_verdict": "approve",
  "execution_context": {
    "repository": "SET-Apps/ai-submodule",
    "branch": "NETWORK_ID/12-auto-propagation",
    "pr_number": 18,
    "policy_profile": "default",
    "model_version": "claude-opus-4-6",
    "triggered_by": "manual"
  }
}
