{
  "panel_name": "test-generation-review",
  "panel_version": "1.0.0",
  "schema_version": "1.0.0",
  "confidence_score": 0.85,
  "risk_level": "low",
  "compliance_score": 1.0,
  "policy_flags": [],
  "requires_human_review": false,
  "timestamp": "2026-02-24T00:20:00Z",
  "findings": [
    {
      "persona": "quality/quality-engineer",
      "verdict": "approve",
      "confidence": 0.85,
      "rationale": "Phase 5a governance artifacts are configuration-only \u2014 no executable code requiring test coverage. Schema, panel, and policy definitions follow existing patterns."
    },
    {
      "persona": "compliance/security-auditor",
      "verdict": "approve",
      "confidence": 0.88,
      "rationale": "Test governance schema defines appropriate verification levels. Strict level for fin_pii_high profile ensures security-critical code has property tests and contract checks."
    }
  ],
  "aggregate_verdict": "approve",
  "execution_context": {
    "repository": "convergent-systems-co/dark-forge",
    "branch": "NETWORK_ID/feat/158/phase-5a-self-proving",
    "policy_profile": "default",
    "model_version": "claude-opus-4-6",
    "triggered_by": "manual"
  },
  "data_classification": {
    "level": "internal"
  }
}
